id,codice_archivio,tipologia,titolo,sottotitolo,prima_responsabilita,altre_responsabilita,luogo,edizione,ente,serie,anno,descrizione,cdd,soggetto,note
1442,1871.02,LIBRO,Atti e resoconto finale delle oblazioni raccolte e dei sussidi distribuiti ai danneggiati nella rovina della sala della Società,Avvenuta il 26 febbraio 1870,[Società di mutuo soccorso fra gli operai in Siena],,,Tipografia A. Moschini,,,1870,"72 p. ; 23,5 cm",945.581,Mutuo Soccorso - Sussidi - Operai - Siena,
1112,PER.ACC.2000.3,PERIODICO,I Nastasi di Siena,,Saverio Salomone,,Siena,Industria Grafica Pistolesi,Accademia dei Rozzi,,2000,"41 p., [11] c. di tav. di cui 3 ripieg. : ill. ; 24 cm",929.75,Nastasi - Siena - Storia,"In questo numero sono presenti i seguenti articoli:
1) Masgalano 2001
2) Il museo di storia naturale dell' Accademia dei Fisiocritici
3) Siena è anche il suo spazio
4) Capolavori, condottieri dimenticati e qualche notizia bibliografica su Siena
5) Alcune questioni testuali e interpretative nelle Rime di Cecco Angiolieri
6) La Recensione. La terra contesa. I Piccolomini contro Santa Maria della Scala 1277-1280"
438,1971.02,LIBRO,Il pulpito di Nicola Pisano nel Duomo di Siena,,Max Seidel,,Milano,Aldo Martello Editore,Opera della Metropolitana di Siena,,1971,"35 p. : ill. , 19 cm",730.945,Nicola Pisano - Duomo di Siena,
211,1997.04,LIBRO,Patrizi e bottegai a Siena sotto Napoleone,Il notabilato urbano di primo Ottocento nell'economia nella politica e nell'amministrazione,Laura Vigni,,Napoli,Edizioni scientifiche italiane,,,1997,312 p. : ill. ; 24 cm,305.5223094558,Nobiltà - Siena,
1788,2012.08,LIBRO,Novelle,Edizione critica con commento a cura di Monica Marchi,Pseudo Gentile Sermini,,Pisa,,,"Biblioteca senese, Studi e testi ; 0005",2012,692 p. ; 21 cm,853.2,Novelle,Anno accademico 2012/2013 in occasione del 150 anniversario della prima edizione de Les miserables di Victor Hugo
1894,1873.01,LIBRO,"Le novelle di Scipione Bargagli, premessavi la narrazione dell'assedio di Siena ",prima edizione senese per cura di Luciano Banchi,Scipione Bargagli,"Luciano banchi, Ignazio Gati",Siena,Ignazio Gati editore libraio,,,1873,"XVI, 223, [3] p. ; 19 cm",,Novelle - Scipione Bargagli - Siena,
1707,LIT.1843.1,LIBRI_DELLA_LITURGIA,Novena per servire di preparazione alla festa del SS.MO Natale,,,,Montepulciano,dalla tipografia di Angiolo Fumi,,,1843,70 p. : 16 cm,,Novena - Natale,XV edizione. Donato dal Gruppo A. S. C. I. (Associazione Scout Cattolici Italiani) al Parroco Don Augusto Ricci il 7 Ottobre 1952.
665,1992.16,LIBRO,Numeri Unici delle Vittorie 1932 - 1939,Riproduzione anastatica dei fascicoli originali,,,Siena,Il Leccio,"Magistrato delle Contrade, Consorzio per la Tutela del Palio",,1992,88 p.  : ill. 36 cm,394.26945581,Numeri unici - Contrade - Siena,Vol. 1
1329,1992.16,LIBRO,Numeri Unici delle Vittorie 1950 - 1954,Riproduzione anastatica dei fascicoli originali,,,Siena,Il Leccio,"Magistrato delle Contrade, Consorzio per la Tutela del Palio",,2006,214 p.  : ill. 36 cm,394.26945581,Numeri unici - Contrade - Siena,Vol. 3
1330,1992.16,LIBRO,Numeri Unici delle Vittorie 1955 - 1959,Riproduzione anastatica dei fascicoli originali,,,Siena,Il Leccio,"Magistrato delle Contrade, Consorzio per la Tutela del Palio",,2006,88 p.  : ill. 36 cm,394.26945581,Numeri unici - Contrade - Siena,Vol. 4
1554,2015.12,LIBRO,Ritorno alla luce,Opere restaurate provenienti dalle collezioni della banca Monte dei Paschi di Siena,Monte dei Paschi di Siena,"Valerio Anselmi, Iacopo Antonio Carli",Siena,Monte dei Paschi di Siena,,,2015,15 p. : ill. ; 21 cm,709.45581,Opere d’arte restaurate - Siena - Collezioni d’arte -  Monte dei paschi di Siena,
1139,CON.PAN.2009.01,PUBBLICAZIONE_DI_CONTRADA,restauri 2,,Contrada della Pantera,Alessandro Leoncini [a cura di],Siena,Nuova Immagine,,,2009,53 p. : ill. ; 30 cm,709.45581,Opere d’arte restaurate - Siena - Contrada della Pantera,
1895,2006.27,LIBRO,Raccolta d'arte senese,,Fondazione Monte dei Paschi di Siena,,Siena,Fondazione Monte dei Paschi di Siena,,,2006-2009,3 v. : ill. ; 28 cm,708.5581,Opere d'arte - Raccolta della Fondazione Monte dei Paschi di Siena,Le campane di Siena; La storia della città. Con un saggio di Mino Marchietti; Introduzione di Italo Moretti
587,1915.01,LIBRO,Siena e le sue opere d'arte,,Luigi Dami,,Firenze,Lumachi Francesco,,La Toscana illustrata,1915,279 p. : ill. ; 18 cm,914.55810913,Opere d'arte - Siena,"Il volume è il n. VI della serie di volumi-guide  ""La Toscana illustrata""  edita  dalla Casa Editrice Francesco Lumachi di Firenze. 
Tra le altre opere di questa serie si ricorda ""L'arte in Val di Nievole"", ""Empoli artistica"", ""Arezzo,. La sua storia, i suoi monumenti"" , ""La Valdelsa"", ""Livorno"". Il volume rilegato in blossura, contiene 28 illustrazioni nel testo e 16 fuori testo."
1375,1905.02,LIBRO,Il sogno di Calafrone,"operetta ballo goliardica in un prologo, due atti e un epilogo",[scene di Giovanni Selvi ; versi di Volfango Valsecchi],[musica di Alessandro Billi],Siena,Stab. Tip. Carlo nava,,,1905,41 p. ; 21 cm,852.912,Operetta,
1020,1929.06,LIBRO,Orafi Senesi,,Ippolito Machetti,,Siena,Editrice D’ Arte “La Diana”,,,1929,"117 p., 73 tav. : ill. ; 32 cm",739.2,Orafi - Siena,
1202,1997.18,LIBRO,Giovanni di Lorenzo dipentore,a sua arte e il suo impegno nell’ oratorio della Torre,Marco Ciampolini [a cura di],"Marco Ciampolini, Patrizia Turrini, Letizia Galli [testi di]",Siena,Edizioni Cantagalli,Circolo Culturale I Battilana,,1997,10 p. : ill. ; 24 cm,759.5,Oratorio della contrada della Torre - Giovanni di Lorenzo,
1265,CON.TOR.2003.01,PUBBLICAZIONE_DI_CONTRADA,L'oratorio della Contrada della Torre San Giacomo maggiore,"restauri, storia e testimonianze",Davide Orsini [a cura di],,Siena,Protagon Editori Toscani,,,2003,63 p. : ill. ; 24 cm,726.50945581,Oratorio di San Giacomo maggiore in Salicotto - Restauro,Pubblicazione edita in occasione dell'inaugurazione dei nuovi locali della Società Elefante il 21 aprile 2007
1200,CON.OCA.2011.01,PUBBLICAZIONE_DI_CONTRADA,Il restauro dell'oratorio di S. Caterina in Fontebranda,,"Enrico Toti , Narcisa Fargnoli , Luca Bellaccini",,Siena,Nobile Contrada dell'Oca,,,2011,63 p. : ill. ; 24 cm,726.50945581,Oratorio di Santa Caterina - Restauri,
1011,CON.OCA.1990.01,PUBBLICAZIONE_DI_CONTRADA,L’ Oratorio di Santa Caterina in Fontebranda,"Le vicende costruttive, gli affreschi, gli argenti",,"Enrico Toti, Peter Anselm riedl, Heidrun Stein Kecks, Monica Butzek, Sabine Hansem",Poggibonsi,Tap Grafiche,,,1990,198 p. : ill. ; 24 cm,726.5094558,Oratorio di Santa Caterina - Siena,
1661,1722.01,LIBRO,In morte dell’eminentissimo gran maestro di Malta fra Marcantonio Zondadari orazione del canonico Lucrezio Venturi,,Lucrezio Venturi,,Siena,"nella stamperia dell’A. R. della sereniss. Gran principessa governatrice, presso Francesco Quinza",,,1722,"19, [1] p. ; 4°",945.581,Ordine di Malta - Storia,
1485,1978.10,LIBRO,Storia dei Cavalieri di Malta,,Arrigo Pecchioli,,Roma,Editalia,,,1978,125 p. : ill. ; 20 cm,271.7912,Ordine di Malta - Storia,
1799,1998.26,LIBRO,L’Ordine di Santo Stefano e la nobiltà senese,,,,Pisa,ETS,,Quaderni stefaniani ; 0017,1998,273 p. ; 25 cm,271.79104558,Ordine di Santo Stefano  - Storia,
664,1993.11.03,LIBRO,Argenti Fiorentini,Dal XV al XIX secolo Tipologie e marchi,Bemporad Dora Liscia,"Bastianelli Maria Elena, Burigana Giovanni Alessandro, Corsini Diletta, Mazzanti Alessandra, Nardinocchi Elisabetta, Strocchi Claudio",Firenze,Spes,,Argenti Fiorentini,1992,465-969 p. : ill. 32 cm,739.237945510903,Oreficerie fiorentine - Orafi fiorentini - 1400-1900 - Cataloghi - repertori,"Vol. 3.: Repertorio di argenti punzonati o datati nel territorio fiorentino: dai Lorena a Firenze capitale
             Schede 340-727
             Leggi e bandi - appendice documentaria - bibliografia - note editoriali"
662,1993.11.01,LIBRO,Argenti Fiorentini,Dal XV al XIX secolo Tipologie e marchi,Bemporad Dora Liscia,"Bastianelli Maria Elena, Burigana Giovanni Alessandro, Corsini Diletta, Mazzanti Alessandra, Nardinocchi Elisabetta, Strocchi Claudio",Firenze,Spes,,Argenti Fiorentini,1993,519 p. : ill. 32 cm,739.237945510903,Oreficerie fiorentine - Orafi fiorentini - Cataloghi - repertori,"Vol. 1.: Presentazioni e introduzione
             Saggi - Tavole dei marchi fiorentini
             Orafi argentieri in Firenze: profili biografici
             Matricole-Censimenti-Documenti
             Indice dei marchi - dei nomi - degli argent i- delle illustrazioni"
663,1993.11.02,LIBRO,Argenti Fiorentini,Dal XV al XIX secolo Tipologie e marchi,Bemporad Dora Liscia,"Bastianelli Maria Elena, Burigana Giovanni Alessandro, Corsini Diletta, Mazzanti Alessandra, Nardinocchi Elisabetta, Strocchi Claudio",Firenze,Spes,,Argenti Fiorentini,1992,463 p. : ill. 32 cm,739.237945510903,Oreficerie fiorentine - Orafi fiorentini - Cataloghi - repertori,"Vol. 2.: Premessa
             Repertorio di argenti punzonati o datati nel territorio fiorentino: dalla Signoria alla fine della dinastia medicea
             Schede 1-339"
1646,1931.05,LIBRO,L'organo della cappella interna del palazzo comunale di Siena,,Luigia Cellesi,,Siena,Stab. Grafico S. Bernardino,,,1931,14 p. : ill. ; 25 cm,,Organo - Palazzo Comunale,
69,2008.01,LIBRO,Un così bello e nobile istrumento,Siena e l'arte degli organi,Cesare Mancini,"v Mangiavacchi , v Martini",Siena,Protagon Editori,Fondazione Monte dei Paschi di Siena,,2008,527 p. : ill. ; 30 cm,786.51945581,Organo < strumento musicale > - Siena,Catalogo della mostra tenuta a Siena dal 24 gennaio all’8 marzo 2009 /promossa da: Comune di Siena ... [et al.] ; curatrice: Laura Vigni
110,2010.08,LIBRO,Dentro l'antico Ospedale,"Santa Maria della Scala, uomini, cose e spazi di vita nella Siena medievale",Beatrice Sordini ,,Siena,Protagon Editori,,Fondazione Monte dei Paschi di Siena,2010,382 p. : ill. ; 29 cm,362.110945581,Ospedale di Santa Maria della Scala,
103,2007.01,LIBRO,Viaggio iconografico nell'antico stato senese,,Ettore Pellegrini,Gianni Resti,Ospedaletto (PI),Pacini Editore,,,2007,150 p. : ill. ; 50 cm,700.94558,Paesaggio nell'arte - Siena - Iconografia,
1017,2004.13,LIBRO,Palazzo Sansedoni,,Fabio Gabbrielli (a cura di),,Siena,Protagon Editori,,Itinerari e proposte  N° 5,2004,504 p. : ill. ; 30 cm,728.82,Palazzi - Siena - Medioevo,"Quaderni dell'Asmos n. 4
In testa al fronte: Archivio Storico del Movimento Operaio e Democratico Senese."
1770,2006.30,LIBRO,Collezione Chigi Saracini nel palazzo di Siena,inventario generale,"[a cura di] Miriam Fileti Mazza, Giovanna Gaeta Bertelà",,Firenze,Stampa Grafica Artigiana Fiorentina,,,2006,540 p. : ill. ; 29 cm,708.558,Palazzo Chigi Saracini,Catalogo della mostra tenuta a Ljubljana nel 2006
336,2010.16,LIBRO,Viaggio nell'arte,Palazzo del Governo di Siena,Anna Maria Guiducci,,Siena,Prefettura di Siena,,,2010,107 p. : ill. ; 27 cm,725.130945581,Palazzo della Provincia - Siena - Opere d'arte,Ristampa dell'edizione pubblicata nel 1993.
608,2004.17,LIBRO,Relazione in compendio delle cose più notabili nel Palazzo e Galleria Saracini di Siena,,Miriam Fileti Mazza,Giovanna Gaeta Bertelà,Siena,S.P.E.S.,,,2004,133 p. : ill. ; 29 cm,,Palazzo e galleria saracini,"Contiene: Appunti di una cronistoria (1954-2003) di Alessandro Monciatti, pp. 79-102"
1614,1950.08,LIBRO,Il Palazzo Pubblico di Siena,,,,Firenze,Electa Editrice,,,1950,"22 p., XXXII p. di tav. : in gran parte il ; 11x12 cm",725.130945581,Palazzo pubblico <Siena>,
1896,2007.50,LIBRO,Moda costume bellezza nel mondo antico : ornamenti dal Museo Archeologico di firenze dall'Egitto all'Etruria,"Museo archeologico regionale Antonino Salinas, Palermo [7 giugno-4 novembre 2007]",,Italia : Soprintendenza per i beni archeologici della Toscana,Livorno,Sillabe,,,2007,79 p. : ill. ; 30 cm,391.00901,Palermo - Abbigliamento - Antichità - Esposizioni - 2007;,"In testa al front.: Ministero per i beni e le attività culturali, Direzione generale per i beni archeologici, Soprintendenza per i beni archeologici della Toscana"
1317,1967.03,LIBRO,Regolamento per il Palio,,Il Campo di Siena,,Siena,Tipografia Senese,,,1967,1 v. : ill. ; 31 cm,394.26945581,Palio,
1492,1984.16,LIBRO,Palio,Vademecum,,,Siena,Edizioni Alsaba,ITIS Tito Sarrocchi,"Corso Tele B. ; 0003 (1984), fasc. 6",1984,"137 p., [5] c. di tav. : ill. ; 24 cm",394.26945581,Palio,
1481,1987.11,LIBRO,I Palii degli anni ottanta,raccolta statistica dei Palii dal 1980 al 1986,Sergio Profeti,,Siena,Sunto,,,1987,1 v. ; 20 cm,394.26945581,Palio,
578,1990.02,LIBRO,Dieci anni di Palio,Le foto e la storia dei Palii degli anni ottanta,Roberto Barzanti; Gianni Tiberi,,Siena,ALSABA,Cassa Rurale ed Artigiana di Monteriggioni,,1990,196 p. : ill. ; 30 cm,394.26945581,palio,
579,1992.12,LIBRO,Cavalli in Palio,,Gianni Giansanti,Fabrizio Palladini,Vercelli,Edizione Whitestar,,,1992,123 p. : ill. ; 33 cm,394.26945581,Palio,
968,1995.13,LIBRO,C'era una volta il Palio: edizione 1995,I cavalli,Roberto Morrocchi,"Giulio Pepi, Daniele Magrini",Siena,,Comitato Amici del Palio,,1995,[46] p. : ill. ; 31,394.26945581,Palio,
17,PER. PAL. 1992.1,PERIODICO,Palio i Giorni della Festa,Aquila,,,Siena,Edizione Alsaba,,,1992,"45 p., 29 cm",394.26945581,Palio,"Rivista fotografica sul  Palio. Donata alla Contrada dal Seggio e da un gruppo di contradaioli (Beniamino Valerio Schiavone, Alessio Collini, Marco Belleschi, Lorenzo Neri, Mattia Tosoni, Riccardo Brandani, Matteo Salvadori, Francesco Gambelli, Andrea Agnesoni, Stefano Meli, Alessandro Marchi, Federico Pistolesi, Piero Nenzi, Senio Teri, Giacomo Tonetti, Valerio Bombaceì)."
18,PER. PAL. 1993.1,PERIODICO,Palio i giorni della festa,Il cencio al Leocorno,,,Siena,Edizione Alsaba,,,1993,"61 p., 29 cm",394.26945581,Palio,"Rivista fotografica sul  Palio. Donata alla Contrada dal Seggio e da un gruppo di contradaioli (Beniamino Valerio Schiavone, Alessio Collini, Marco Belleschi, Lorenzo Neri, Mattia Tosoni, Riccardo Brandani, Matteo Salvadori, Francesco Gambelli, Andrea Agnesoni, Stefano Meli, Alessandro Marchi, Federico Pistolesi, Piero Nenzi, Senio Teri, Giacomo Tonetti, Valerio Bombaceì)."
19,PER. PAL. 1994.2,RIVISTA,Palio i giorni della Festa,"Tartuca, un Palio d'altri tempi",,,Siena,Edizione Alsaba,,,1994,"61 p., 29 cm",394.26945581,Palio,"Rivista fotografica sul  Palio. Donata alla Contrada dal Seggio e da un gruppo di contradaioli (Beniamino Valerio Schiavone, Alessio Collini, Marco Belleschi, Lorenzo Neri, Mattia Tosoni, Riccardo Brandani, Matteo Salvadori, Francesco Gambelli, Andrea Agnesoni, Stefano Meli, Alessandro Marchi, Federico Pistolesi, Piero Nenzi, Senio Teri, Giacomo Tonetti, Valerio Bombaceì)."
20,PER. PAL. 1995.1,RIVISTA,Palio i giorni della Festa,Cianchino e Oriolu come un'Onda,,,SIENA,Edizione Alsaba,,,1995,"61 p., 29 cm",394.26945581,Palio,"Rivista fotografica sul  Palio. Donata alla Contrada dal Seggio e da un gruppo di contradaioli (Beniamino Valerio Schiavone, Alessio Collini, Marco Belleschi, Lorenzo Neri, Mattia Tosoni, Riccardo Brandani, Matteo Salvadori, Francesco Gambelli, Andrea Agnesoni, Stefano Meli, Alessandro Marchi, Federico Pistolesi, Piero Nenzi, Senio Teri, Giacomo Tonetti, Valerio Bombaceì)."
21,PER. PAL. 1995.2,RIVISTA,Palio i giorni della Festa,"Pantaneto, via di Bella Speranza",,,Siena,Edizione Alsaba,,,1995,"61 p., 29 cm",394.26945581,Palio,"Rivista fotografica sul  Palio. Donata alla Contrada dal Seggio e da un gruppo di contradaioli (Beniamino Valerio Schiavone, Alessio Collini, Marco Belleschi, Lorenzo Neri, Mattia Tosoni, Riccardo Brandani, Matteo Salvadori, Francesco Gambelli, Andrea Agnesoni, Stefano Meli, Alessandro Marchi, Federico Pistolesi, Piero Nenzi, Senio Teri, Giacomo Tonetti, Valerio Bombaceì)."
22,PER. PAL. 1996.1,RIVISTA,Palio i giorni della Festa,Oca col nerbo,,,Siena,Edizione Alsaba,,,1996,"61 p., 29 cm",394.26945581,Palio,"Rivista fotografica sul  Palio. Donata alla Contrada dal Seggio e da un gruppo di contradaioli (Beniamino Valerio Schiavone, Alessio Collini, Marco Belleschi, Lorenzo Neri, Mattia Tosoni, Riccardo Brandani, Matteo Salvadori, Francesco Gambelli, Andrea Agnesoni, Stefano Meli, Alessandro Marchi, Federico Pistolesi, Piero Nenzi, Senio Teri, Giacomo Tonetti, Valerio Bombaceì)."
23,PER. PAL. 1996.2,RIVISTA,Palio i giorni della Festa,Bruco è vero,,,Siena,Edizione Alsaba,,,1996,"66 p., 29 cm",394.26945581,Palio,"Rivista fotografica sul  Palio. Donata alla Contrada dal Seggio e da un gruppo di contradaioli (Beniamino Valerio Schiavone, Alessio Collini, Marco Belleschi, Lorenzo Neri, Mattia Tosoni, Riccardo Brandani, Matteo Salvadori, Francesco Gambelli, Andrea Agnesoni, Stefano Meli, Alessandro Marchi, Federico Pistolesi, Piero Nenzi, Senio Teri, Giacomo Tonetti, Valerio Bombaceì)."
30,PER. PAL. 2000.3,RIVISTA,Palio i giorni della Festa,Prima Selvanta in campo,,,Siena,Edizione Alsaba,,,2000,"72 p., 29 cm",394.26945581,Palio,"Rivista fotografica sul  Palio. Donata alla Contrada dal Seggio e da un gruppo di contradaioli (Beniamino Valerio Schiavone, Alessio Collini, Marco Belleschi, Lorenzo Neri, Mattia Tosoni, Riccardo Brandani, Matteo Salvadori, Francesco Gambelli, Andrea Agnesoni, Stefano Meli, Alessandro Marchi, Federico Pistolesi, Piero Nenzi, Senio Teri, Giacomo Tonetti, Valerio Bombaceì)."
32,PER. PAL. 2001.2,RIVISTA,Palio i giorni della Festa,Il Dè è un Drago,,,Siena,Edizione Alsaba,,,2001,"63 p., 29 cm",394.26945581,Palio,"Rivista fotografica sul  Palio. Donata alla Contrada dal Seggio e da un gruppo di contradaioli (Beniamino Valerio Schiavone, Alessio Collini, Marco Belleschi, Lorenzo Neri, Mattia Tosoni, Riccardo Brandani, Matteo Salvadori, Francesco Gambelli, Andrea Agnesoni, Stefano Meli, Alessandro Marchi, Federico Pistolesi, Piero Nenzi, Senio Teri, Giacomo Tonetti, Valerio Bombaceì)."
33,PER. PAL. 2002.1,RIVISTA,Palio i giorni della Festa,Dè! Come punge l'Istrice!,,,Siena,Edizione Alsaba,,,2002,"75 p., 29 cm",394.26945581,Palio,Rivista fotografica sul  Palio. Donata alla Contrada da Beniamino Valerio Schiavone
34,PER. PAL. 2002.2,RIVISTA,Palio i giorni della Festa,"Berio, la sonata del ferro di cavallo",,,Siena,Edizione Alsaba,,,2002,"75 p., 29 cm",394.26945581,Palio,Rivista fotografica sul  Palio. Donata alla Contrada da Beniamino Valerio Schiavone
35,PER. PAL. 2003.1,RIVISTA,Palio i giorni della Festa,Ansano benedice il giovane Sgaibarre,,,Siena,Edizione Alsaba,,,2003,"69 p., 29 cm",394.26945581,Palio,Rivista fotografica sul  Palio. Donata alla Contrada da Beniamino Valerio Schiavone
36,PER. PAL. 2003.2,RIVISTA,Palio i giorni della Festa,"Bruco Berio Bruschelli, il Palio delle tre B",,,Siena,Edizione Alsaba,,,2003,"72 p., 29 cm",394.26945581,Palio,Rivista fotografica sul  Palio. Donata alla Contrada da Beniamino Valerio Schiavone
37,PER. PAL. 2004.1,RIVISTA,Palio i giorni della Festa,"Giraffa, scossi e vincenti",,,Siena,Edizione Alsaba,,,2004,"61 p., 29 cm",394.26945581,Palio,Rivista fotografica sul  Palio. Donata alla Contrada da Beniamino Valerio Schiavone
38,PER. PAL. 2004.2,RIVISTA,Palio i giorni della Festa,Alesandra dà ragione al Bruschelli,,,Siena,Edizione Alsaba,,,2004,"61 p., 29 cm",394.26945581,Palio,"Rivista fotografica sul  Palio. Donata alla Contrada dal Seggio e da un gruppo di contradaioli (Beniamino Valerio Schiavone, Alessio Collini, Marco Belleschi, Lorenzo Neri, Mattia Tosoni, Riccardo Brandani, Matteo Salvadori, Francesco Gambelli, Andrea Agnesoni, Stefano Meli, Alessandro Marchi, Federico Pistolesi, Piero Nenzi, Senio Teri, Giacomo Tonetti, Valerio Bombaceì)."
39,PER. PAL. 2005.1,RIVISTA,Palio i giorni della Festa,Berio e Bruschelli è record,,,Siena,Edizione Alsaba,,,2005,"61 p., 29 cm",394.26945581,Palio,Rivista fotografica sul  Palio. Donata alla Contrada da Beniamino Valerio Schiavone
40,PER. PAL. 2005.2,RIVISTA,Palio i giorni della Festa,La regola del quattro,,,Siena,Edizione Alsaba,,,2005,"62 p., 29 cm",394.26945581,Palio,Rivista fotografica sul  Palio. Donata alla Contrada da Beniamino Valerio Schiavone
41,PER. PAL. 2006.1,RIVISTA,Palio i giorni della Festa,Il bacio della Pantera,,,Siena,Edizione Alsaba,,,2006,"62 p., 29 cm",394.26945581,Palio,Rivista fotografica sul  Palio. Donata alla Contrada da Beniamino Valerio Schiavone
42,PER. PAL. 2006.2,RIVISTA,Palio i giorni della Festa,"La forza di Caro Amico, l'estasi di Salasso",,,Siena,Edizione Alsaba,,,2006,"61 p., 29 cm",394.26945581,Palio,Rivista fotografica sul  Palio. Donata alla Contrada da Beniamino Valerio Schiavone
43,PER. PAL. 2007.1,RIVISTA,Palio i giorni della Festa,Pelle d'Oca,,,Siena,Edizione Alsaba,,,2007,"63 p., 29 cm",394.26945581,Palio,"Rivista fotografica sul  Palio. Donata alla Contrada dal Seggio e da un gruppo di contradaioli (Beniamino Valerio Schiavone, Alessio Collini, Marco Belleschi, Lorenzo Neri, Mattia Tosoni, Riccardo Brandani, Matteo Salvadori, Francesco Gambelli, Andrea Agnesoni, Stefano Meli, Alessandro Marchi, Federico Pistolesi, Piero Nenzi, Senio Teri, Giacomo Tonetti, Valerio Bombaceì)."
45,PER. PAL. 2008.1,RIVISTA,Palio i giorni della Festa,"Lassù qualcuno lo ama, Istrice era Già tutto scritto",,,Siena,Edizione Alsaba,,,2008,"63 p., 29 cm",394.26945581,Palio,"Rivista fotografica sul  Palio. Donata alla Contrada dal Seggio e da un gruppo di contradaioli (Beniamino Valerio Schiavone, Alessio Collini, Marco Belleschi, Lorenzo Neri, Mattia Tosoni, Riccardo Brandani, Matteo Salvadori, Francesco Gambelli, Andrea Agnesoni, Stefano Meli, Alessandro Marchi, Federico Pistolesi, Piero Nenzi, Senio Teri, Giacomo Tonetti, Valerio Bombaceì)."
46,PER. PAL. 2009.2,RIVISTA,Palio i giorni della Festa,la Civetta domina nella notte,,,Siena,Edizione Alsaba,,,2009,"63 p., 29 cm",394.26945581,Palio,"Rivista fotografica sul  Palio. Donata alla Contrada dal Seggio e da un gruppo di contradaioli (Beniamino Valerio Schiavone, Alessio Collini, Marco Belleschi, Lorenzo Neri, Mattia Tosoni, Riccardo Brandani, Matteo Salvadori, Francesco Gambelli, Andrea Agnesoni, Stefano Meli, Alessandro Marchi, Federico Pistolesi, Piero Nenzi, Senio Teri, Giacomo Tonetti, Valerio Bombaceì)."
47,PER. PAL. 2010.2,RIVISTA,Palio i giorni della Festa,Il Rospo bacia il Principe e lo risveglia come in una favola,,,Siena,Edizione Alsaba,,,2010,"62 p., 29 cm",394.26945581,Palio,Spese a carico del Ministero dell'Interno per l'interessamento particolare dell'Ufficio Centrale degli Archivi. Numero XXIII delle pubblicazioni degli Archivi di Stato.
1773,PER.4GI.1987.1,PERIODICO,4 giorni di Palio,13/16 agosto 1987 Pantera,,,Siena,Edizione Periccioli,,,1987,48 p. : ill. ; 31 cm,394.26945581,Palio,
1897,PER.4GI.1996.2,PERIODICO,4 giorni di Palio,13/16 agosto 1996 Valdimontone,,,Siena,Edizione Periccioli,,,1996,50 p. : ill. ; 31 cm,394.26945581,Palio,"All'interno si trovano i seguenti articoli:
1) Accademici Rozzi nella Cappella Musicale di Provenzano
2) Pia Tolomei fra mito e realtà
3) Il Monte dei Paschi di Siena
4) ""Delitti e castighi"" nella Siena medievale
5) Carlo Fontana, il Cardinal Flavio Chigi e l' Accademia dei Rozzi
5) I Mercanti e la Mercanzia: il monumento alla Croce del Travaglio
6) Siena medievale. Modello di urbanistica organica
7) Le imperfezioni della memoria: l' Archivio dei Rozzi
8) Lo stile Ratatouille
9) Quell' Archivio dove ""ricerca"" faceva rima con ""amicizia"""
1769,PER.NGM.1926.1,PERIODICO,The National Geographic Magazine ,,Maire Luise Handley,,Washingtton D.C.,,,Volume L Number TWO,1926,25 cm :ill. ;,394.26945581,Palio,
1898,PER.PAL.1998.2,RIVISTA,Palio i giorni della Festa,Nicchio il mondo è blu,,,Siena,Edizione Alsaba,,,1998,70 p. : ill. ; 29 cm,394.26945581,Palio,Rivista fotografica sul  Palio. Donata alla Contrada da Beniamino Valerio Schiavone
31,PER.PAL.2001.1,RIVISTA,Palio i giorni della Festa,Ugo ha scosso la piazza,,,Siena,Edizione Alsaba,,,2001,"61 p., 29 cm",394.26945581,Palio,Rivista fotografica sul  Palio. Donata alla Contrada da Beniamino Valerio Schiavone
44,PER.PAL.2007.2,RIVISTA,Palio i giorni della Festa,Il Leocorno dello Scompiglio,,,Siena,Edizione Alsaba,,,2007,"63 p., 29 cm",394.26945581,Palio,
1899,PER.PAL.2008.2,RIVISTA,Palio i giorni della Festa,"Bruco , Elisir d’Amore",La freddezza di Gingillo e la forza di Elisir: il cencio di Ceroli in via del Comune,,Siena,Edizione Alsaba,,,2008,63 p. : ill. ;  29 cm,394.26945581,Palio,
1900,PER.PAL.2009.1,RIVISTA,Palio i giorni della Festa,è Già passato alla storia,Il tempo da record di Menhir e la freddezza di Gingillo portano il cencio in Castelvecchio,,Siena,Edizione Alsaba,,,2009,63 p. : ill. ;  29 cm,394.26945581,Palio,
1901,PER.PAL.2010.1,RIVISTA,Palio i giorni della Festa,Voglia di vittoria,La grigia Fedora porta il cencio in Vallepiatta. La Selva sempre pià prima selvalta in campo,,Siena,Edizione Alsaba,,,2010,64 p. : ill. ;  29 cm,394.26945581,Palio,
1814,NUN.1945.2,NUMERO_UNICO,Poini ma…boni,,Contrada Priora della Civetta,,Siena,Contrada Priora della Civetta,,,1945,12 p. ill. ; 34 cm,394.26945581,Palio,Numero Unico in occasione del Palio Straordinario del 20 agosto 1945
669,1945.02,LIBRO,Il Palio di Siena 2 Luglio-16 Agosto,,Virgilio Grassi,,Siena,Editoriale d' Arte,,,1945,20 p. : ill. ; 22 cm,,Palio,"Opuscolo divulgativo.
Copertina di Dino Rofi datata 1945."
611,1950.03,LIBRO,Il Palio delle Contrade di Siena,"Cenno storico e schema del corteo, V° centenario della canonizzazione di S.Bernardino, Palio Straordinario del 28 maggio 1950",,,Siena,Arti grafiche Lazzeri,Comune di Siena,,1950,4 p. : ill. ; 18 cm,,Palio,Opuscolo di quattro pagine pubblicato in occasione del Palio Straordinario del 28 maggio 1950
644,1984.10,LIBRO,Palio,Vademecum,ITIS Tito Sarrocchi Siena,,Siena,Alsaba Grafiche,,,1984,"137 p., [5] c. di tav. : ill. ; 24 cm",394.26945581,Palio,"Numero di Corso Tele B, periodico scolastico dell'ITIS T. Sarrocchi di Siena."
1805,NUN.1932.1,NUMERO_UNICO,Nerbo Sciolto,,Nobile Contrada del Nicchio,,Siena,Nobile Contrada del Nicchio,,,1932,8 p. : ill. ; 32 cm,394.26945581,Palio  - 1932,
